"","V2"
"349","If there is ever a place to experience an array of differences in the human race, it is at OSU.  I don't think that there is a race, religion, socio-economic, or sexual orientation that I have not been exposed to while at Ohio State.  Students seem to be aware of the variety and have embraced them with activities, clubs, and groups.  The Multicultural center allows for incorporation of racial diversity.  LGBT and religious organizations are common and widely used.  Numerous religious centers are located within or close to campus.  Students come from all over the United States to attend OSU, so there is not an overwhelming student population from one particular area.  With the presidential primaries coming up soon, many students have taken an active role in supporting and soliciting for their particular candidate.  Students are also trying to get others aware of the candidates, issues, and making it a point to stress the importance of our votes.  One student in my class is part of a political organization on campus and brought absentee application forms to class to hand out to anyone who is not registered in Franklin County to vote and also offered to send them in for us free of charge.  This proactive stance is exactly what our nation needs to help get everyone out to the polls."
"350","An ideal and diverse university that offers unlimited opportunities to learn and meet new people."
"351","My school is all my dreams put into one reality."
"352","Being a Buckeye allows you to recieve and excellent education while making great friends, watching great sports, and meeting great people."
"353","OSU has high school spirit, excellent acedemics and an amazinf social experience to top it off."
"354","Ohio State is a large diverse learning environment where students can find easily their niche through student organizations, Columbus community and  general love of football."
"355","Ohio State is exciting and a very large friendly campus."
"356","THE Ohio State is a hugely connected community full of opportunity, fun, and great people always ready to help a fellow Buckeye."
"357","Ohio State is in my opinion the greatest university in the country; a place where all students can be themselves, have pride in being a Buckeye and take part in athletic events,understand and reach one's maximum potential, realize that college isn't just for an education, but a place to make friends and connections; and lastly Ohio State allows students to learn for themselves while still giving back to the school and community."
"358","Utah Valley University is a very helpful school for those attending their first year of college, those perusing a further degree/ education, and those returning to earn their degree."
"359","The Ohio State University is everything anyone could ever want."
"360","The Ohio State University is a very large school with many opportunities."
"361","Ohio State University is a very reputable institution, featuring a colossal range of academic programs for undergraduates and undecided majors to select from and over 800 recreational student organizations all located on an urban campus that's complete with social amenities, information resources, and green space that altogether creates an aesthetically and academically pleasing environment."
"362","Ohio State is a ""complete package"" university; it gives students the expansive opportunities of a large state university, while also providing the tools for students to create the intimate experience of a small unveristy."
"363","A very large and diverse campus, where one can easily find any group or niche of people he or she desires."
"364","Ohio State is greatly underestimated for its academic merit because it is also an athletically successful college."
"365","Ohio State University is a school for everyone to find a degree that meets their needs. Within each program are immense amounts of different paths available for students to take which is what makes Ohio State University so unique. My school is very large so I can be free to study whatever I please and study it with the most state of the art equipment and highest rated professors in much depth. This university may be large and prestigious which sounds promising on a work resume, but it is also full of school spirit and a sense of community."
"366","My school is passionate, exciting, dedicated, and difficult; it allows me to grow and make everlasting friendships."
"367","Ohio State is a very research based and academically centered college, but we still have a great respect and love for our sports (they're almost as important to us as our grades)."
"368","Ohio state is humongous, academically challenging, socially accepting, and incredibly fun."
"369","Ohio State University is a school which cares about every student the way they should be treated; along with giving every student an opportunity to obtain and education, as well as a bond for life."
"370","OSU is place where buckeye pride is abundant, people are studious yet they are able to enjoy themselves, it is a perfect mixture of studying and fun."
"371","My time at Ohio State has been the best experience of my life."
"372","Ohio State is awsome, offering so many opportunities!"
"373","Ohio State is a premier academic institution that is just the right balance of school work and partying."
"374","great place with lots of spirit, fun people, and rigorous studies, if you enroll in the right ones."
"375","This school is so much fun and a lot of hard work, I love it here!!"
"376","The Ohio State is a prestigious university with the opportunity for superior academic excellence but the feel of a family reunion where football, fun and food brings everybody together for four (or more) of the best years of your life!"
"377","campus is a very home like place to leave, the school itself didnt give me any form of grant or scholarship, only loans to borrow out which i am not happy about. hopefully things change next year or else i'll transfer to a different school."
"378","The most spirited, lively, exciting, thrilling, thought-provoking experiences of my life have happened here."
"379","My school represents great tradition, excellence, and a sense of family."
"380","Very football oriented"
"381","An intense yet amazing jumble of midterms, coffee, walking in the snow, essays, huge lecture halls, small classes, grilled cheese at the union, and sore feet."
"382","The Ohio State University is an exciting, adventurous, educational place that is not only enjoyable but also in the top schools for education."
"383","A place full of spirit, where people go to meet new people and have experiences impossible to get at any other school."
"384","Ohio state is a large campus with a such a dynamic compilation of different ethnicities and backgrounds; the educators have a similar range of expertise."
"385","The Ohio State University can be described as a social, as well as academically challenging, campus encouraging all to receive the most from their studies and to benefit from the networking opportunities available to broaden ones horizens and shape their character for the future."
"386","Diverse and extremely big."
"387","Ohio State is a school that offers students the ability to search themselves and understand who they really are as a person."
"388","The Ohio State University is a vibrant and diverse learning place."
"389","Big, bustling and full of diversity."
"390","Ohio State is a welcoming, fun, and creative educational environment for every individual."
"391","It is an extremely large educational institution with many possibilities and options, but it fails to accomodate individual students, and it emphasizes its physical commodities and athletics rather than educational advantages."
"392","A place to learn, grow as a person, and gain the true college experience while being supported  and pushed to succeed."
"393","The Ohio State University offers the best college education in Ohio."
"394","The opportunities at Ohio State are endless,  there are many great people to meet, many sites to see, and lots of things to explore!"
"395","Ohio State is whatever you make of it; it's full of opportunity but you have to be willing to work for it."
"396","The Ohio State University is a very welcoming place where students have an overwhelming sense of pride and loyalty; a place where lifetime friendships are formed, and a place where countless promising careers have been started."
"397","A body of hard-working, driven students full of school spirit."
"398","My school is one of the more superior schools in the nation."
"399","Ohio State is a large research institution; not much professor-student interaction."
"400","Ohio State is an amazing school, which creates a family environment, supporting students to take advantage of opportunities in the community, country, and world."
"401","My school is the greatest place on earth, I can't imagine anywhere I'd rather be."
"402","The Ohio State University is an academically, activively, helpfully and full of athleticism school in which its students take pride from and its influence  pushes them further in their future."
"403","Rich in tradition, academically great, one (if not the largest) of the largest universities in the nation, a highly respected institution along with some pretty great sports teams such as are collegiatic champion sychronizing swim team and the 2010 Rose Bowl Champs."
"404","Buckeye football. (Although I do not participate in this)."
"405","My school is a clean is and secure place to attend and I appreciate that the campus is kept in pristine condition."
"406","A diverse population that allows a variety of opportunities"
"407","Ohio State is awesome!"
"408","Ohio State is a school passionate about getting everyone involved through their use of athletics, clubs, and on campus activities."
"409","A jewel of Ohio."
"410","The Ohio State University is a prestigous and reputable institution."
"411","Ohio State is a potpourri of cultures, people and ideas, a mini melting pot of one part work and one part play, and a place where academic revolution is encouraged and social evolution is whole-heartedly welcomed."
"412","Ohio State University is the best school around. The campus, students, and professors are amazing and make the college experience one to remember and enjoy."
"413","My school is an abundance of knowledge and wisdom wrapped into a living community that is truly a universe."
"414","The Ohio State University is the most spirited, driven, free-spirited, beautiful, historical, well-known, alumni-loving, student-oriented, academic, unbelievable, extraordinary university, campus, and community you have ever set your eyes upon."
"415","This school is a competitive institution that equips students with the skills and knowledge that are necessary to confront and solve various challenges."
"416","The Ohio State University is full of opportunities for it's students, accepting of different backgrounds and lifestyles, prestigious in it's academics, amazing with it's research, beautiful across campus, and inviting to all interested students."
"417","Ohio State University is big, but offers a lot."
"418","AWESOME"
"419","It's crazy-awesome fun, but very challenging."
"420","OSU is diverse, yet unified, and full of opportunities."
"421","My school is AMAZING!"
"422","Ohio State has a very big campus, but the instruction is great and the academic advisors do a good job of focusing on the individual."
"423","I love it!"
"424","The largest school in the nation!"
"425","It is fun, interactive, holds vast opportunities and prepares you well for your career choice."
"426","OSU is what you make of it--if you aim to fail, you fail, if you aim to succeed, you succeed."
"427","Large, fun, happy family."
"428","There are countless opportunities to excel at Ohio State."
"429","When I get older and my life memories become few and far between, I know that of those few precious memories I still hold onto, there will certainly be ones of my time at The Ohio State University."
"430","The weather has finally started warming up, and students show their favorite type of clothing to wear- shorts, swimsuits, anything but sweatshirts and heavy coats. This video takes place in the Oval, where hundreds of students gather when the sun's out to tan, play catch, or watch others tan and play catch."
"431","Ohio State University is school that is very fun and exciting in terms of the social atmosphere while at the same time is a challenging and fast-paced school academically."
"432","A small community of diverse, caring, driven individuals."
"433","Ohio State University is a really great school for meeting so many different types of people from all kinds of backgrounds. I really love all of my professors this quarter and I am engaged in all of our discussions. The dorm life is very fun and I meet new people every day. It really is a great atmosphere here. Go Bucks!"
"434","One of the best state universities with great academics, athletics, research, and healthcare."
"435","absolutely wonderful!"
"436","Sucks"
"437","The Ohio State University is a well-balanced, creative school that has my best interests in mind."
"438","Ohio State is an amazing school with a fresh, positive environment that brightens its students days with even a simple walk around campus."
"439","My school is awesome."
"440","O- H....... I- O!"
"441","Ohio State is a school full of excitment with new people to meet and new information to learn, spirit with a passion to be a buckeye, and opportunities with the highly accreditated majors."
"442","The Ohio State University is one of the best places that you can attend.   Not only are the professors amazing at teaching but they are passionate  about the subject.  You will meet many amazing friends that will be there for life, and an education that will establish your future.  Attending this school was the best idea of my life and wish that I would have started here.  I have no complaints about anything on this campus from the classes to the faculty to on and off campus fun."
"443","This school is very well-rounded and awesome!"
"444","Ohio State is a great school.  There is so much to do around campus and it is easy to meet people.  There are sure to be some people that you will relate to and it is very easy to have fun.  Academically, Ohio State is highly regarded among employers and is harder to get into than most other colleges."
"445","It is a large, diverse learning community that adequately prepares students for post college job opportunities."
"446","Largest university in the United States."
"447","Ohio State is a welcoming school that provides students with any opportunity they could want from studying abroad to clubs to academics to learning about different cultures and the more a student gets involved the smaller the campus feels."
"448","It's fun!"
"449","my school is the greatest in all aspects and I am so proud to be a student."
"450","The Ohio State University is home to many people who are like myself."
"451","The Ohio State University is a spirited community that is passionate about many areas of student's lives, such as academics, research opportunities, social events, career/job placements, and overall well-being."
"452","Get an internship; develop an advising relationship with one of your professors"
"453","Large school with a small campus feel."
"454","A huge institution with endless opportunities for learning, diversity, and networking with a perfect location in downtown Columbus, Ohio."
"455","A place to work in state of the art facilities, with top notch professors while building lasting friendships with fellow buckeyes who love their school."
"456","A diverse school that makes sure that everyone is treated equal so that everyone receives the same great education"
"457","The Ohio State University is a place where students can engage in specialized academics, diverse student organizations, and community of friendly, high-spirited people."
"458","Strong school spirit and research."
"459","An amazing experience that I would do over again in a heartbeart"
"460","The Ohio State Unversity is an academically challenging university that prepares you for both a future career and for the ""real world."""
"461","Lots of school-spirit with helping teachers and alumni to help us achieve any goal"
"462","Absolutely amazing at sports, academics, research, job placement, and overall college life!"
"463","Full of spirit and striving toward the future."
"464","The Ohio State University  is known for their commitment to research and innovation, which is something to be very proud of but sometimes I feel it may be standing in the way of providing a condusive learning environment and professors that are genuinely interested in teaching."
"465","Large, yet quaint; urban, yet relaxed; big, yet cozy; exciting, yet comforting; nice."
"466","Big and diverse to the point where it gives you a great understanding of the world, and differences."
"467","It's a well rounded school; people think that sports is the only thing that OSU has, but honestly, they're outsiders."
"468","Ohio state univ. is a great school.  Close to the urban capital of Ohio (Columbus Downtown).  Great companies are based in Columbus (Nationwide, Limited, Charley's Sub, etc.)  Large international communty which makes it easy to expense other cultures without leaving the campus area.  Other great cities to travel to like Cinncinati, Cleveland, Detroit, and Chicago.  One of the largest schools in the country so your always meeting someone news when you head out to party."
"469","A spectacular school that anyone can fit into and know they are preparing themselves for a great future."
"470","OSU is competative in every nature, but the schools energy and information you learn will sustain you a lifetime."
"471","OSU has more students than most other Universities. Contrary to belief, the large student body actually brings a lot of benefits. You are bound to find others with similar interests, and you can always find something to do. The size also allows the school to budget great teachers, maintain great facilities (like the recreation center) and put on great student events (like concerts)."
"472","Ohio State is unlike any school I have ever been to.  The traditions bring everyone together and make you feel like you are part of something bigger than yourself.  On a football saturday you can yell OH and you will hear dozens of IO's in response.  If you want to go to a school with excellent academics, but also have fun by being involved in clubs or intramurals, this is the place to be."
"473","It is really big, which is a huge advantage and not really a drawback at all. There are so many options, and each department is small and personal, so it's really easy to fin something you love and have the support to excell in it, and you have the option to change your mind with minimal stress."
"474","It is HUGE! Also, a degree from OSU compared to the other schools I've considered would give me a higher chance at landing a job in my field, because of its great academics, expectations, standings, and opportunities."
"475","The fact that it is so big is something unique.  Other schools are big, but not like Ohio State.  And even though it's big, they still make a big school seem small by incorporating many different clubs and activities to participate in.  In fact, Ohio State just created there thousandth club this year!"
"476","The Ohio State University is one of the few schools in the nation  which is fully devoted to promoting their students and helping them make progress in their careers.  These various options and opportunities are tremendous, making them unique in caring about the future of their students. These qualities make OSU one of the best schools that I had considered when applying to a university. After discovering these opportunities, it became evident that OSU trully cared about their students. The benefits of being in the university and it's programs make it one of the best in the nation."
"477","Its size allows for a huge range of activities, majors, resources, and types of people.  Its academics may not be on an ivy league scale, but the school holds a high esteem among universities.  There are many opportunities here academically and socially."
"478","The Ohio State University is a fantastic place for anyone who wants a world class education and a social life. The size ensures that possibilities are endless, but the faculty remains fantastic and accessible. Job placement is great - there are more Buckeye alumni in the world than any others with executives in Goldman Sachs, Limited Brands, and countless other powerhouse corporations."
"479","I attend a university with the largest campus in the nation. When I was making the decision of where I wanted to go to college, I considered the uniqueness of Ohio State.  It's diverse culture and intriguing history still come alive today through school spirit. Whether you are attending  an OSU football game or just walking to class, you always feel the connection that makes every student a buckeye. OSU also offers a diverse extra-curriculum, it is truly a college for everyone."
"480","Ohio State and the greater Columbus area has a great variety of activities, restaurants, social events, ways to get involved that represent its cohesive family. This university is very accepting of all peoples, and is eager to inculcate that same acceptance into all its students. Columbus is a very trendy city but holds onto its history. With areas like Short North, the Arena District, and German Village, there's always something going on for every person."
"481","It is the largest single campus in the US! It's huge, has a lot of research opportunities, and is absolutely gorgeous. The view from the 11th floor study in the library is breathtaking."
"482","To start off, the campus is extremely diverse. Kids that go to my universities feel at home when they attend school. There's no one dominant race, and everyone gets along like a family. The school's academic programs are one of the best due to it's scholarly reputation."
"483","The thing that is so unique about Ohio State is its plethora of opportunities. It has many school groups, majors, clubs, etc that students can enroll in. Its size is also memorable, with over 50,000 students. It's a beautiful campus with grass, trees, and amazing structures. It is known for its diversity and large variety of students from everywhere thinkable. For example, I am friends with girls from Croatia, Israel, Spain, and Belgium. It's so nice to meet lots of different types of people."
"484","Buckeyes"
"485","The size.  Ohio State is a massive place, and no matter where you go you'll always see something new and exciting.  The diversity of this place is spectacular, and I know that compared to other schools the variety of activities is considerable.  The campus is also known for having events that bring a large body of people together, especially home and away football games."
"486","The fact that this school is so big, but feels so small.  I love that you can walk across the oval and see people you know, and not feel overwhelmed by the amount of people.  It was also a lot more comfortable and well layed out compared to others visited.  The people were all friendly and considerate as well."
"487","The amount of people that attend the school and the fact that there is a major or cliche for any one person that chooses to come here. The city is big enough to make a name for yourself or hide within the crowd."
"488","The school spirit is extremely strong and creates a bond between the students."
"489","The students and teachers at OSU come from many different cultures, religions, and ethnic backgrounds.  Class sizes at OSU are also very big compared to other universities."
"490","School Spirit! Go Bucks!"
"491","This school is accepting of all cultures. This school demands you be accepting of all cultures as well. This school teaches all aspects of a subject not just the aspects that are most popular (for example evolution and creationism).  This school has something for everyone - volunteer groups, religious groups, choirs, dance teams, sports.  This school is large but well respected. There is an unbelievable amount of school pride here. This school requires students to be educated in various subjects in addition to chosen major topics."
"492","The Ohio State University is very unique with their determiantion to make a very qualified individual in the area of study in which they have chosen. Additionaly they have a great campus life style with many places to study and relax with friends. The Ohio State University promotes studying with friends and meeting new people to further enjoy your college experience. Lastyly, the sports are amazing, especially the football team. The thrill of being a part of the tradition that the football team carries is very gradifying."
"493","I am majoring in Agricultural Education. I wanted to go to a college in Ohio. Ohio State is one of two colleges in the state of Ohio that offers Agricultural Education as a major.  I really like the quality of instruction at Ohio State and thought it would be a good school to prepare me to be an agricultural education teacher."
"494","Very flexible environment. Near in location to many employment opportunities. Great campus atmosphere."
"495","The Ohio State University is obviously much bigger than any other school I was considering. It is definitely a larger campus than other colleges, but once you are here and you know where everything is, it really is not overwhelming or anything! The main thing about Ohio State is the academic program and the great career connections that is has for graduates. The fact that it is so big allows for more opportunities to meet someone, who knows someone, who can help you get a job once you are done with school!"
