"","V2"
"49","Best thing: smart people who are there to learn, you can talk about the most academic things anywhere, any time and it's all good.

Change: More time for fun, it would be cool if people didn't take themselves so seriously.

Reactions: A lot of people have never heard of Reed. If they have they either think you're really smart, a hippy drug addict, or a rich pretentious snob.

Most time on campus is spent in the library, or walking from the library to get a coffee.

Sometimes you forget you are in a city, but Portland is really cool.

Administration is always crap, but some years marginally better than others.

There is alt-school pride, it's not like many people wear the sweatshirt, but there's a kind of combat veteran pride with each stage you survive (Hum 110, Junior Qual, and of course Thesis)."
"50","The best thing about Reed is the intense atmosphere, it pushes you to your limit and makes you a stronger person from it. Paradoxically this is also one of the works things about Reed, it can become really overwhelming.

Most people think Reed students are smart...

There is a lot of school pride. Reed students seem to have the perception, that they are working the hardest and are some of the smartest students anywhere in the Us."
"51","Reed students are amazing individuals with a passion for learning and changing the world in ways no one else thinks are possible."
"52","Socially awkward, pompous half-hipsters with an inferiority complex that they overcompensate for with academics."
"53","The illest of the ill, the dopest of the dope, the dankest of the dank, the smartest, brightest, most inventive motherfuckers in this whole country who are going to rule the world; we are the bluest smurfs out there."
"54","I've mentioned already that diversity is a bit of a problem.
Mostly that's racial diversity, though. The queer community at Reed is fantastic, I think. Further, I'm pretty happy with the mixture of classes and backgrounds Reed has achieved. Though there are certainly plenty of rich kids, more than 50{4a082faed443b016e84c6ea63012b481c58f64867aa2dc62fff66e22ad7dff6c} of the student body is on some form of financial aid and I personally know a few who have a full ride. So we are okay in that respect.
Religious issues are tricky. It's no secret that the majority of Reed students don't fall into easily defined religious categories. However, beyond the input of a few fanatic atheists, acceptance rules. That is, just because you are a Christian and I'm not doesn't mean we can't be BFF and absolutely respectful.
That being said, I do not think that a staunchly conservative person will find any easy time at Reed. If we think you're wrong, it's likely that we'll question your beliefs. If you can't handle that, you might have a problem. Of course, it's just as unhelpful to be a close-minded liberal, but since the majority of the Reed population will agree with your beliefs, you likely won't experience the same degree of confrontation."
"55","The most socially incompetent, amazing people I have ever met."
"56","You got your yippies, your pool sharks, your Rugby boys (like me) and your Dungeons and Dragons players,  but they're all reedies - extra-intellegent, extra-intellectual, and sharp as knives."
"57","They are quirky misfits and enthusiastic, unapologetic nerds."
"58","Liberal, open-minded, and quirky."
"59","When I went to Reed it was very white, but the stats that are coming out nowadays show more diversification of the student body.  Many Reedies are well-heeled and worldly (lots of diplomats kids), but they tend to hide their wealth by refusing to bathe.  Nurturing environment for LGBT.    

Reedies are not known for their social skills.  Somehow, miraculously, the Reed alums I have met post-graduation have figured out how to hold a conversation about something other than a book.  Actual Reedies tend to spend too much time at their assigned library desks to know how to introduce themselves without the assistance of a few beers."
"60","Reedies are the most intelligent, most awkward, and consistently atypical people I've ever met. There is no ""Reedie prototype."" We're different, and motivated by one thing: learning. Learning about the world, learning about each other, learning about ourselves. There's really not much more I can say."
"61","We're pretty open around here. There's a sign on the door to the women's center: ""Reed women's center, all genders welcome."" I love that they say ""all"" instead of ""both."" It's little touches like that that can make you feel welcome.
There is a lack of racial diversity, and some African-American students feel alone in a sea of milk, but probably the people who would feel most out of place here are fundamentalist religiosos. If you aren't willing to debate your beliefs, you won't be happy at Reed."
"62","Most of student body spends far too much time in the library, but somehow, amidst the bookwork people are able to operate clubs and have events they are passionate about. Dinner conversations come in almost all flavors imaginable: from Foucault to P-diddy. I almost always come away having learned something and enjoyed myself. Campus events are numerous and turnout is usually modest. Sport event turnout is close to zero with what few sports are on campus. The larger turnouts are usually for dances and parties on campus on friday and saturday nights."
"63","Every person is completely different, there are some stereotypes but for some reason nobody discriminates anyone for what they do and say... everybody is very respectful."
"64","Diverse in some ways. I don't want to run over the stereotypes again, but of course at every college there are certain groups; there are the theatre kids, there are the kids who never leave the library, there are the frisbee team, there is senate. But honestly, these groups blend in and out of each other, and Reed is so small, I have seen little evidence of cliques alienating certain people. Perhaps this is because there is a certain fundamental similarity between most Reedies. In general, they like to talk, about everything from sex to drugs to philosophy and academia. You can find the people you will love, and then of course, you will also find the people who you merely interact with because you have to. But I feel a lot o goodwill and community at Reed, generally, if you put a smile on your face, you'll get a huge one back :)"
"65","As I said, Reedies are very creative and industrious.  They will spend days on projects to make campus better or more interesting.  Plus there is a lot of funding for these projects available through Senate.  However, there isn’t as much effort put into projects aimed at bettering the world outside of Reed’s “bubble”.  There are political groups or groups for human rights but these groups are frequently not as well attended as the joke communist group aimed at distributing communal small bikes around campus or free stimulants in the library lobby during finals week.  Another important point about the students is that we are all governed by the honor principle.  It’s not a joke among Reedies.  Profs trust you to take a closed book test anywhere on campus, including your dorm room, and know that you will not cheat.  Students leave their laptops in the library while they grab a snack from commons all the time and stuff is rarely stolen."
"66","See above"
"67","Reed students come from all over the place.  We are primarily a liberal, and somewhat agnostic school...well let me just quote the historic school slogan...Atheism, Communism and Free Love.  This motto was of course born in the sixties, but some of the spirit has remained."
"68","I would like to say that Reed students are diverse, original, colorful, creative, interesting. I would like to say that Reed students are politically active, internationally aware, environmentally friendly. And, for the most part, those things would be true. The Reed student body is made up of an eclectic mix of unique individuals, each with their own call to learning and passion for life. I have met the best artists of any art I've ever seen, the most dedicated and knowledgeable political activists, the most life-experienced, the most poetic, the most graceful, the most travelled, the most comfortable-with-who-they-are, and the most honest and honorable people I have ever met amongst Reed students. I have fallen in love with girls, dorm mates, house advisers, and drug addicts, none of whom I ever kissed or who even ever knew I loved them.

I think the pure, unadulterated spirit of Reed comes alive when a student or group of students lets go, smiles at people, takes their clothes off and/or costumes ridiculously, climbs to the top of Eliot Circle in front of the library, plays, sings, or performs loud music and dances around, vocalizing. If you can't see yourself fitting into this, you will feel uncomfortable at times, and possibly never feel like a true Reedie.

Reedies also have a committed dedication to that O Holiest of All Things that Come on a Golden Tripod, Time, with an accent above the e. That is to say, Greek honor. Reed has an Honor Council, a Judicial Board, and honest peers. When you take a test, even a final exam, there is no professorial supervision, no qualifier of Non-Cheater, not even a ceiling-installed surveillance camera. You are an adult, and you are honorable. If you take a test on which it is not honorable to read from a book or look over your friend's shoulder, you will not. The same is true for any act of honor or dishonor, and periodic discussion groups appear across campus at which such acts are defined in a student's moral code of judgement. These codes and abilities of discernment, if not already pre-instilled, will progress with the Reed student beyond his or her years at Reed, out past the bubble, and into the ""real world"" (where, sometimes, things happen that are a little less than honorable)."
"69","The student body is insane. Altogether we are politically aware and politically apathetic. We are not what you would call ethnically diverse. Rather, we are regionally and intellectually diverse. We have more African students than African-American students. If you are a minority student, don't let this deter you. You don't need a minority crowd to chill with, you need an intellectual bond with people who think differently than you. You'll find that but again... it'll drive you crazy."
"70","As a science major, I've got no idea what goes on on the rest of campus.  I sort of live in my office.  Not everyone does, but not everyone is as dumb as me.  If you're african american, you might feel out of place here, but then again, if you have money maybe you're used to having lots of rich white jewish friends.  I wish that this campus was a bit more diverse, but then again few people can afford an education such as this.  But such is the way of the United States.  If you're extremely religious you probably won't be too comfortable.  Most of the college is ""atheist.""  In actuality very few people are atheists, and they are just too stubborn to admit that their agnostic.  Religoin is widely excepted but if you try to preach your own damn gospal you will be beaten up intellectually by people questioning all of the logic, that extremely religious people tend to ignore.  Students here are very liberal and very politically active.  One of the question prompts for this section is ""what do most students wear to class?""  If you actually care about what you wear, this may not be the right school for you.  Lots of people here are hipsters, some people here don't care what they look like and some do.  But if clothing choice is a factor in your decision for college, then Reed is not the right place for you because academics are far far more important than looks.  You will come here and assume that at least one student is actually a crazy hobo.  Then that student will be in one of your classes, and no matter how hard you try, he'll be a hell of a lot smarter than you."
"71","Most students here are very laid-back (I have overused this word, I know) friendly people who love talking about almost anything.  Some people dress to impress, others dress to stand out, but most just dress casually.  It's considered ""weird"" to come dressed up in suit and tie, but not the bad kind of ""weird""!  There are also a lot of animal-loving people on campus and you will find a lot of vegans attend Reed.  Most students lean left, but are very thoughtful about it. If someone takes issue with something another person believes, mostly it'll end in a huge debate but there are rarely any huge issues on campus.  One thing that does set Reed apart is the large number of smokers on campus."
"72","Reed is very white, and very privileged. There is growing and productive critique of this, largely from organizations like the Feminist Student Union, Black and African Student Union, and Multicultural Resource Center.  For the most part, though, most students and administration are very comfortable with their elite positioning and only give nominal attention to discussions of race and class. 

But on another topic, as a queer lady I found a huge amount of support at Reed. I felt comfortable, I felt visible, and I felt like we had space to organize and be heard. There is a large and welcoming queer and activist community of people doing amazing work and taking amazing care of one another. Of course there were plenty of issues that came up in dealing with administration and in navigating classrooms dominated by entitled, mostly male voices, but at the same time, those issues were continuously talked about and resisted."
"73","Lots of Californians. Lots of liberals. Not as big into money, probably because they grew up with plenty. Students can wear pretty much anything and not get teased about it. Girls typically don't do the whole make-up/blowdried hair deal, although a few do. Some very shy people, awkward people, borderline-asbergers people. Some very friendly outgoing people. Students are often not that politically active 'cause they focus on their schoolwork too much, but I do know some anarchist-type activists. Drug use is very prevalent and accepted, although students who don't use drugs definitely exist too--not a problem as long as they accept that they'll be friends with folks who do use. People of all types can hang out. Although we have a few exclusive meanies, not very many."
"74","Everyone's a little bit queer here, so it seems. It's certainly fashionable to be LG or at least hetero-flexible. But straight people are also still socially accepted. 
I'm not rich. Not even close. There are other people who aren't as well. But I was flabbergasted as to the number of students on campus who don't need financial aid when i got here. But just because their parents are rich doesn't mean the students drives BMW's. Plenty of them choose to reject their rich parents and wear the same thrift-store purchased clothes for weeks at a time. 
Not a lot of racial diversity in Portland (compared to say, San Francisco or NYC). Reed has several race-related groups such as the Latino-student union, the Black men's student union, etc. 
What do most students wear to class? Whatever they fucking feel like, whether that be a bathrobe, wedding dress, cape, historical reproduction of Elizabeth's corset, or fetish boots. Or, you know, clothes. 
There are as many different types of student as there are students, and yes we interact. 
Most of us are from CA, and most of those are from the Bay Area. 
There are activist/political groups on campus that are rockin'. 
Academics don't usually earn much cash. They spend too much on school and spend all their time locked away, so there's little to brag about. And performance artists, like myself, may expect to live very humble lives."
"75","There are all types here. My first roommate was a pan-sexual vegan gal from Minnesota whose girlfriend was a tranny, for example.  The student body is predominantly white, and often it feels like most of the minorities are from abroad.
There was an incident at Halloween with some dummies being hung from trees - which created a scandal (especially in light of certain current events).  But the prank wasn't done with malice or anything, more it shows how the Reed campus often has a lack of racist conceptions.
Reedies seem to be mostly from the east coast, with a lot of Bay area people, some NWerners and midwesterners and fewer southerners.
I think the financial situations are extremely diverse.
Reed students often have very little concept of what's happening out in the world, we call it the ""Reed bubble"". There's so much happening with school, that current events often feel like an overload.
Definitely a left campus, but there are many a right winger here - and I don't think they get a lot of shit.
Reedies don't EVER talk about earning potentials. Most of us have no fucking clue where we'll be in twenty years. Sure it would be nice to have money someday, but most people are looking for an invocation not a bank roll."
"76","Reed is full of hipsters. You can recognize them by their lame haircuts and remarkable ability to name at least five unknown indie bands in any conversation. I try to avoid them. 
Reed, like most of Oregon, is very white. I went to a public high school in a major city, so Reed is much whiter than what I'm used to. There are minority students, and a multicultural resource center, and we all interact with one another. Students tend to group themselves based on academic interests and extracurricular interests. For example, a lot of the linguistics students hang out together, and some of them are also in the association of Reed gamers, and they tend to hang out together. My roommate has friendships that seem mostly based on a love of Guitar Hero. The student body as a whole is less inherently politically charged than it used to be, but there are political groups on campus that organize events. 
While many students at Reed come from an upper middle class background, there are also many, many students on financial aid. We're ALL worried about finding jobs after graduation, but that has more to do with the current economy than with how well Reed is preparing us for the real world."
"77","Reed is white. Lily white. Entitled upper-middle-class to upper-class brats who have decided to be liberal and weird. Reedies like to think that they are a cut above the rest. They also have very very little courtesy. The average middle-class American would NOT fit in at Reed, in fact, he or she would be made to feel very small indeed."
"78","Reed is trying to diversify but it is pretty socially and racially homogenous. Most people here are white and upper-middle to upper-class. This can get frustrating. No one I've met is openly racist, though, and it's anathema to flaunt wealth (people try very hard not to act privileged).  

Students are predominantly liberal and non-religious. There are very few practicing religious people (I know two or three) and very few Republicans (though I know several libertarians and plenty who just don't care). 

There are LOTS of jews (secular/non-practicing, as a rule), LOTS of Californians, LOTS of socially awkward (and usually lovable) people, LOTS of cigarette smokers, LOTS of people with a genuine interest in learning for its own sake. And LOTS of psych majors, for some reason, or maybe I just run into them oddly frequently.

For the most part, I feel comfortable interacting with different groups of students. There are clear groups but there are plenty of travelers also. 

You will probably feel out of place at Reed if you fit under any of these definitions (though it shouldn't necessarily stop you from coming--the school could use more diverse opinions):
1) Very religious
2) Very conservative
3) Very against drug use (you probably will not be pressured to use drugs yourself if you are against it, but be aware that drugs, especially weed, are very common. If smelling pot smoke bothers you, you will be probably be annoyed a lot.)
4) Very close-minded 
5) Very against academic wankery (there's a lot of that here. It's lots of fun unless it bugs you, in which case it can get very annoying very fast)."
"79","Racially, religiously, socio-economically not diverse.  Not one bit.  You can find good community if you try and work for it, but as a whole community that is safe and healthy, Reed has much room for improvement."
"80","Immature.  People here are so immature they still take notes on their hands.  Memo to the Reed Student Body:  Grow up.  You're not in sixth grade anymore.  And no, you are not as smart as you think you are."
"81","The LGBTQ community on campus is really great. Reed is really one of the best places to be gay in the US I think. It's really a non-issue. Otherwise, Reed is not racially diverse, and is often very sexist. I think it would be a difficult place for hispanic, black, and female students not because of actual oppression but because people are so politically correct that oftentimes dialogue that needs to happen just doesn't happen. As far as clothes go, you can wear basically whatever you want and no one will care, it's all been done before. Also there is a LOT of money at Reed, lots of very wealthy students."
"82","LGBT folks are very much accepted.  People seem to try to be different in clothing and manner.  People are generally quite nice, though.  Alot of Reedies from California...perhaps too many.  If you don't swing left...well, even the outdoors trip leaders swing left, and they just work here occasionally.  If you didn't come in a democrat, you'd probably leave one."
"83","Reed's ethnic makeup is not very diverse; as a Hispanic person, I feel that the student body needs a serious makeover, in terms of attracting minorities. On the other hand, I have never experienced racism or any other overtly negative interactions because of my ethnicity; all people, whether genuinely or because of politically correctness, are very respectful and tolerant of diversity. People who identify with LGBT culture are overwhelming accepted and embraced. Students wear whatever they want to class, generally; from pajamas to suits. The student body is very much left of center and a majority could be classified as middle-to upper class."
"84","Reed student body is not diverse. The school in recent years has been making some steps in the right direction in order to create some more diversity on campus, but as of right now the student body is mostly middle to upper class white students. The students that do go to Reed, regardless of their race or class tend to hold relatively similar ideas in respect to politics and also what is socially and culturally acceptable and what is not. Most Reed students are from the West Coast, as Reed does alot of its recruiting from California and the surrounding Northwest area. There are alot of self-prescribed 'acitivists' and 'anarchists' on campus, although I'd say there are probably nearly as many true politically and socially aware students as well. The student body has alot of people who were considered nerds or social outcasts in highschool and there is an understood stigma at Reed that Reedies are really awkward and sometimes border on completely inept in social circles. I would say the most uncomfortable type of student at Reed would be a Black, Evangelical, straight-edge conservative who eats alot of steak and drives a hummer."
"85","The Reed student body needs more diversity.  While Reedies are typically liberal, progressive, informed individuals, they are on the majority white and privileged.  This makes being a minority somewhat difficult, because as smart and liberal as some kids are, the lack of exposure to people of different backgrounds, whether ethnic, religious, or socio-economic results in ignorance, and even a reluctance for open dialogue about important issues in the minority community.  There are some support centers for minority students, but the majority of the student body has never had to confront issues of racism, classism, or sexism but many assume that they are an authority on these issues and as a minority student, I feel uncomfortable with this."
"86","apathetic in general, but that seems to be changing with new Hum 110 initiatives and a stricter drug and alcohol policy.  Everyone is different and there is a group of friends for every type of person.  You can be yourself at this school.  Conformity doesn't exist (unless you want the attention of the hipsters), and you can truly be yourself on campus."
"87","Reedies are not a homogeneous group. If you make an effort, you will find people you with whom you fit in. Queer kids in particular are welcome. There are some militantly atheistic students at Reed, but my Christian and Muslim friends seem to feel comfortable. The one exception: vocally intolerant bigots are generally unwelcome.

There are apparently a lot of very sensitive students at Reed, and as a result, every bit of political incorrectness incites an uproar. I view this as a sign that Reed welcomes students of every possible background. Politically and religiously conservative students are rare, but won't have trouble feeling welcome as long as they are assertive (but not aggressive!).

A few common threads among Reed students: they are unmotivated by future earning potential, they want to make a difference in the world, and they are very, very bright."
"88","Reed does its best to diversify the student body. I think conservative Christians are probably the smallest minority at Reed.  I encountered just about any possible demographic group while I was a student at Reed.

Most students are casual with dress, no one seems to care.  Yes, I found a high degree of interaction between groups of students.  The Reed dining hall is not segregated into cliques, everyone eats together."
