"","V2"
"24","Portland is a great city to live in. It's kind of european-modeled utopian, where people ride their bikes, care about sustainability, experience an excellent performance art and music scene, and are herbivores. Nature abounds, close to the city limits, and people actually appreciate it! Sigh... it just so *nice* to live here. (Except for the disheartening rain and the lack of racial diversity)
Some Reedies never see Portland, in all of it's glory. Reed can be kind of a ""bubble"", in which students become encapsulated and lose touch with the outside world. I understand. Reed is a magical mystical land, unlike any other, where people ride around on flaming bikes, build really big monuments and forts in public places, grill hundreds of dollars worth of meat and give it away for free just to piss off vegans like me, make motorized couches, couches that double as bongs, embrace pyromania, chase and tackle people while naked and covered in blue paint, know nearly everyone's name because it's so freaking small, etc. There are a lot of resources and fun stuff to keep Reedies occupied, in all the free time they don't have, like the comic books library, pool hall, Gray fund trips (white water rafting, rock climbing, interesting-shit-you-never-needed-to-know-about-portland tours, and the like), I could go on but you could just go to the website. You could spot the legendary Doyle Owl and get into a knife fight over it! Kidding (though it seriously did happen). Reed is a very ...unique college experience, both due to the institution and its values and also because of the people who are attracted to it."
"25","Reed College is a land where the work never stops. It's go go go and then break and then go go go and then break.  The school is small but you definitely don't know or recognize everybody.  Classes are usually from 6-25 people (lecture-based classes like the sciences are more 25-100 people).  You get to know and love the profs, who you will be on a first name basis with.
Telling people you go to Reed can evoke a multitude of responses from ""Wow"" to ""Doesn't everyone do drugs there all the time?"" to ""Reed College?"".
Reed is the perfect school if you want to go into academia, and/or if you honestly like learning.
We're in Portland here, but we rarely leave campus.
Last biggest scandal was a recent heroin overdose - but that shit is really fucking rare, everyone has been in shock and there has been a lot of school arranged support groups and such.
You get an education at Reed like you get no where else, and that inspires a definite cockiness and school pride bit in the students.  We visit other campuses and wonder when people get their shit done, and the truth seems to be that they often have very little shit to do. So we laugh about that. Call it intellectual snottiness, if you will.
Reed is a very strange place, as shown by the student body and by campus events.  Ask any Reed kid (who isn't a freshmen) about Renn Fayre, Drag Ball, Paideia, Thesis Parade, thesis-ing, junior seminar, or qualifying exams and you'll here many a tale."
"26","Reed is a tiny, liberal arts college. The campus is pretty, but small enough that once you've slept with someone, there's no way to avoid them. You'll keep running into them in commons, or the pool hall, or that class you thought they wouldn't take but they did and now you have to sit in the same room with them three times a week and pretend it isn't awkward. The population of Reed is big enough, however, that I'm still meeting new people in my year. The academics are phenomenal, and Portland's a fun city (although it helps to be 21). It's easy to get involved with student government, or just get some funding for a new extracurricular group. We don't have a football team, but the rugby players are all very dedicated to their sport. Ultimately, Reed is work hard, play hard -- we might stay in the library until 2 AM on a regular basis, but we also have more fun. There's nothing I would change about Reed, and having been here for four years, I can say with absolute certainty that I would make the same choice if I were picking a college now. That said, Reed is NOT for everybody."
"27","Most Reed students ar really excited to be here, which enhances life for our whole community. It's great that people are really excited about and interested in not only their classes and assignments, but also about social activities at Reed. There are so many opportunities to get involved in the Reed community, like during Renn Fayre, Reed Arts Week, Paideia, etc. There's always some sort of dance party or event going on in the Student Union to liven up weekend nights on campus, and it seems that wherever you go there are groups of intelligent kids to hang out with, like at the pool hall, the scrounge, the paradox, the library lobby, the tutoring center, the department-specific lounges, even the reactor!"
"28","Reed is isolated. It's in a bubble, and never shall that bubble burst. It's unfortunate, since Portland is a truly amazing city with TONS to offer, and so few Reedies take advantage of that. Reed is also quite small. It tends to be very difficult to make friends at Reed, although I'm not entirely certain why."
"29","People here tend to be interesting whether I like them or not, which is awesome. You can have a conversation with almost anyone and learn something. Most everyone works very hard, much harder than they did in high school, though a fair number of students (mostly freshmen) dick around a lot and have academic trouble accordingly. The work load is not exaggerated--if you do all the work you are supposed to do AND try to have a social life, you won't get a lot of sleep. Quite a few people drop out. 

The honor principle governs most interactions at Reed. There's a lot of trust in students' ability to handle problems, and so there's a lot of responsibility. 

When I tell people I go to Reed, I get a lot of different responses. Mostly tonal variations of the word ""OH."" Everyone knows we work hard here, but there are a lot of other connections that people make--drugs, radical left-wingers, awesome open-minded people, and so on. Reed has a reputation. It's not entirely accurate. There is a lot of drug use, and as a rule people are pretty liberal, but I know plenty of straightedge people and several libertarians (though, granted, very few Republicans)."
"30","Reed will give you student funds to spend on beer.  However, I when I wanted to spend student body funds on giving books to prisoners, I was told by Finance Committee, ""We don't give money for service projects.""

Reed will not let allow student organized charity drives to spend our extra board points to give food to the homeless.  They are so afraid of liability that they couldn't care less if the people of Portland go homeless."
"31","Reed is kind of small so everyone knows everyone and you can tell immediately who's a Reedie and who isn't when you see them. Also, it seems like you run into Reedies and Alumni all over the place in Portland and sometimes other random places. A lot of people have never heard of Reed, but those who have always have strong feelings about it. I spend most of my time in my dorm because sleep takes long times. Most recent big controversy was the hanging up of dummies in the trees in Eliot Circle."
"32","A recent spate of resignations from top administrators has called into question the current president's reputation. I know from a number of professors that they do not like the direction the current administration is heading, but from their perspective I can't say what is really at stake in the long-run. I can say this: I've never met president Diver, although he did grow up in the same town as me; albeit in a different time. The only things I've heard from him have been about his ""politically neutral"" charades in which he has declined to divest school money from Coca-cola even though the majority, if not everyone, on campus has advocated for divestment. I think this supposed ""neutrality"" is a thinly veiled attempt to hold onto a corporate endowment package put together by Reed's financial ""experts."" Recently, race has played a big role in the college's public life. A poorly planned Halloween tableau involved hanging paper bodies from nooses in the trees at the center of front circle. It made its way onto the pages of the Oregonian, which inflamed the belief that Reed students are naive intellectuals (true) that don't care about what they do to others (false, as it turns out). There were apologies and discussions. The multicultural resource center hired a speaker to give a lecture on the significance of lynching symbols in America. I can't say I attended, so I don't know if anyone else did, but it was a relatively poor attempt to smooth over the past and return to our bubble-like intellectual naiveté. The question is: how do you fan a discussion over difficult topics when the entire ""Reed experience"" is essentially deconstructive, centered on the self as the fundamental unit of inquiry? Reed does its masochistic job pretty well. You'll come out with a fine ability to get things done and think about them. But I worry that people all too infrequently ask themselves: what can I do for you? It's cultural problem, but Reed's not helping."
"33","The best thing about Reed is that it takes itself and its philosophy seriously.  Reed tries to be a school that takes the community and academics seriously, and will do just about anything to make sure that they run well.  The administration is very involved and helpful, and the level of bureaucratic inefficiency is generally pretty low.  Portland is a great town - almost an epicurean paradise.  Within a few miles, there are fantastic restaurants that are very reasonably priced (compared to Boston) and the bar scene is great.  Portland is also known as Beervana.  So many great local brews.  Unfortunately, school pride is pretty lacking, although there's generally a pretty good turnout for the big school events.  People definitely come to Reed to learn, and there's alot of people that do only that."
"34","People outside the bubble and outside Oregon don't generally know where Reed is, much less what it is. However, grad schools seem to notice us. The student body ranges from total slackers to high-strung bookworms; however, the majority could be described as academically motivated students with a high tolerance for books, as well as a high affinity for parties. Commons (the cafeteria), the Paradox coffee shops, and common rooms in dorms are the most popular spots to chill. While Reed doesn't have any traditional signs of school pride like a football team and fraternities, most students feel lucky to be here."
"35","Reed is an excellent school for several reasons.  For one, classes are generally small and allow for student participation and the guarantee that your professors will get to know you individually.  Although the student body is very intelligent, there doesn't seem to be a whole lot of unhealthy, annoying competition between students over grades, because Reed doesn't give grades! This system is ideal because grades are actually recorded, but instead of relying on numbers or a letter system to gauge success, professors write more comments of each paper and test.  This allows for one-on-one interaction between students and professors and for individual growth in the classroom.  Reed also has so many awesome and strange traditions, such as the end of year Renn Fayre (which has nothing to do with usual Renn Fairs), Paideia, and several annual themed dances."
"36","academics.  All the students are here to learn, plain and simple.  Though you may have ""that kid"" in one of your conferences the majority of REedies are intellectual, will challenge your views, and not afraid to express their opinions.   The investment you make in learning here is the best investment you can ever make in your life.  If you don't plan on going to grad school, a Reed degree in and of itself is not to important.  Generally, Reedies come to this school to cultivate their minds, learn about the academic orthodoxy and how to counter it, and to head to grad school."
"37","The best thing about Reed College is that there's no place like it. At no other college can you expect to find  such a diverse and interesting group of people united at the prospect of becoming experts in their field, more enlightened members of society, and more capable human beings. You may get the impression that everyone you meet is on an epic quest. And you will frequently be impressed by the progress that your colleagues make. Everyone is transformed after four years. Everyone finds the instruction, facilities, and intellectual sounding boards required for progress. The espirit de corps is a manifestation of the rigor of the college. And everyone is glad for the challenge, indeed they pay for it. There's no other place like that."
"38","I wouldn't change a thing about Reed. I enjoy telling people I went there, and having them react with shock and awe.  When I was a student, I spent most of my time in class or in the library.

I think Reed does a very good job of essentializing what is necessary for an education (i.e. a small number of students per class, close work with professors) and excludes all the distractions (i.e. textbooks, sports teams, the Greek system)."
"39","The biggest controversy on campus at the moment is the attempted change in the cigarette policy. There is a pretty much unsaid rule that you can smoke in the pool hall though it is a room in the GCC and technically illegal. Recently the administration tried to pull a fast one on the students and were charging kids 100$ for smoking indoors. Student Senate and the whole student body got really up in arms about the change in policy without consulting the students or even making an announcement. Then, the administration had to back down and revert back to the old policy. We're seeing our student autonomy slip like sand between out fingers and we're all crying as it slowly dies. Oh, and Portland is tight."
"40","Reed is small. Only 1500 students. That makes for a very small average class size, which translates to some great student participation. For me, that is the best thing about Reed: your peers are thinkers, like yourself, and they share their ideas and insights. When you can regularly pick up a shared epiphany from a colleague, or a perspective that gives you chills for its subtlety, and helps you with your own exploration of the material, it is easy to get addicted to the Reed methodology. 

If I would change anything, it would be having the library stay open 24 hours a day. It's open until 2 am most days, but I think it's time for Reed to find a way to keep it open all the time. 

Reed is growing, and at a rate that I think is modest, and well-considered. The school prides itself on being small so growth is approached with great concern and restraint.

People don't know anything about Reed except people in Portland. Because it is so small, it isn't well-known outside of the area. In Academia, it is well-known, and very favorably. That's what counts to me. 

Portland is the BEST town to be in! It's quirky, cool, and sophisticated. It's got the best bookstore on the planet a short 20 minutes away - what else do you need? And there are lots of great restaurants, cultural centers, and music venues nearby. 

The administration is cool, and the staff is astounding. This college really seems to take the time to make sure students get the important things taken care of. It is unusual in that respect. 

We have controversy on campus, yes. One case recently showed how adept the school can be in dealing with problems. Students were involved from the get go, and the solution was homegrown and sensitive. The issue continues to be discussed, and I think it was a learning opportunity for everyone. I am proud that the community came together the way it did.

Super unusual? Reed's 'Renn Fayre,' and all out party after finals week. It cannot be compared with anything else. You just have to experience it for yourself."
"41","The best thing about Reed is the intellectual environment. You are never without a problem to solve or an argument to put together.
I would change the tour guide mentality. They come across as morons.
Reed is perfectly sized.
95{4a082faed443b016e84c6ea63012b481c58f64867aa2dc62fff66e22ad7dff6c} of people have no idea what Reed is, and assume that it is a second-rate place for rich smart kids. The other 5{4a082faed443b016e84c6ea63012b481c58f64867aa2dc62fff66e22ad7dff6c} know that it is a first rate place for smart kids (many of whom are pretty well off)
I spend most of my time in my room.
Portland is a great city, but you won't get off campus much.
The Reed administration is highly competent and pretty hard-nosed.
Biggest recent controversy was grafiti that got put on an art exhibition.
No school pride, except we all miss Reed when we arent here.
Reed is so academically charged that it is extremely unusual for a college.
Renn Fayre is quite memorable, though over-hyped.
Our cafeteria dramatically overcharges for EVERYTHING."
"42","Reed. It's a great collection of creative ""quirky"" amazing people who have a large drive to learn, and spend almost too much time studying. There is a ridiculous work load, but you'll learn to read faster and how to read affectively. I spend most of my time on campus split between the library, the scrounge and the sportscenter- mostly in the library. Sometimes it's hard to strike a balance between life and academics, as the academics at Reed can at times be overwhelming. It's a really good idea to take some time away from Reed when you're here, to gain a perspective and make sure you have the drive to come back and finish at Reed. 
Portland is an amazing and fun city, but when you're at Reed you don't always have time to appreciate everything it has to offer. Students often get trapped ""in the bubble"", especially those students who live on campus. Owning a bike is a necessity in Portland."
"43","Personally Reed was a great match for me and despite the crushing workload and all, I still really love it. I don't think it is a school for everyone. I think a lot of people would hate coming here. It's hard. You will not have as much time as other college students you know to leave campus, even though Portland is great if you make it there. If you are a science major, you'll probably have days when you don't see the light of day, after 4 hour bio lab, you will get out and you will look at the dreary Portland sky and miss the sun. The sun does come out, and when it does it's great because everyone appreciates it and goes outside. But sometimes it rains all week. Sometimes you won't even notice because you'll spend all week in the library. 

On weekends though, and on days when you don't have to study like crazy, the campus is a great place to be and if you get tired of dancing here, or seeing movies here, Portland is everything you could ask for in a city, except that some things close kind of early. But there is a lot of stuff to do on campus. Everything really comes alive and there's a really exciting, fun culture in between the intense academics."
"44","*the best thing about reed is its roster of unique events and traditions you won't find anywhere else, like noise parade (exactly what it sounds like); fetish ball (again, exactly what it sounds like); RKSK (Reed Kommunist Shit Kollective, a group responsible for various forms of mischievous fun, included but not limited to: supplying library with stuffed animals for late-night cuddling; kommunal borscht; giant skrabble (winners often receive spliffs); kommunal umbrellas for use during rain season; random couch/hammock placement; the sunny day vodka lemonade kart; and most importantly, kommie bikes--cheap kid's bikes spray painted red and left around campus to use at your convenience.); couches on the lawn; and above all Ren Fayre, the end of the year celebration of out and out craziness and bacchanalia involving lots of insane projects, many of which are burned/destroyed ceremonially, Thesis Parade (burning of seniors' thesis drafts), champagne showers, music, nudity, drug piñatas, fire, and sometimes a moon bounce! best time of the year.

one thing i'd change: people's condescending, hipper-than-thou attitudes.

size: a bit too small--i thought that's what i wanted, but a few hundred more people would be nice.

reed reactions: a lot more people have actually heard of reed since it was dubiously dubbed one of the ""new ivies"" by newsweek. i get questions about the academic rigor, portland, and of course, the drugs. one kid i met at a party senior year asked me where i was going and when i told him i was headed to reed, he said, ""awesome. i mean, they smoke a lot of weed there, people are crazy."" then he paused and said, ""but wait, don't you have to be, like, really smart?"" i told him that on the rare occasions i am not partying, i actually read and stuff.

place on campus i spend the most time: tie between the library and the student union, as grungy as the latter is (it's charming).

town: yes a college town, but more accurately an urban lite city. the food here is great--more thai, vietnamese, and japanese than you can try--and there are some great quirky neighborhoods complete with vintage stores, record stores, bars, all sorts of cool crap. good music scene too--unless you're under 21. when your favorite band comes to town, you probably won't seem them until they come back after your 21st birthday.portland is not an all-ages friendly city, or even much of a 24-hour one even if you are.  coming from a big city like chicago, portland sometimes doesn't feel like a real city at all--it's very new, unsettlingly clean in some parts, and doesn't have the same kind of diversity. 

reed administration: a mixed bag. there are some great folks intent on preserving reed's uniqueness and defending student interests...and some who aren't. but the administration does go out of its way to involve students in important decisions involving new policy, professor appointments, and more.

school pride: yes and no. in many ways i am proud to call myself a reedie and share weird stores that my friends at university of illinois might not even believe. i am proud of the focus on learning rather than performing. but it's a love-hate relationship, and i think most students would say the same. somtimes you love reed, sometimes you fucking hate it.


everything is unusual about reed. but we do have in-door plumbing.

experience i'll always remember: my first renn fayre. just not the actual order in which my experiences occurred and some other hazy details about that weekend like how i ended up asleep on a bean bag in the basement laundry room."
"45","People are typically impressed when they find out I go to Reed, that is, if they've ever heard about Reed before.  There is a lot of school pride, but I think that it's often the sort of pride that one feels towards a child that's doing much better than can be expected, but is still falling short of its full potential."
"46","There are three distinct reactions when people find out I go to Reed. Many people have never heard of it, and those who have are either familiar with it as an elitist intellectual haven or a place filled with sex, drugs, and indie rock."
"47","I like how seriously academic study is taken at Reed. Sometimes it is even taken too seriously. In my opinion, however, if one is going to go to college to study you might as well go to a place that specializes in valuing academics above all else. However, this is sometimes taken to extremes, and people should know this before coming to Reed. Therefore, I would change how reed advertises itself.  I would want them to say that it is less of a normal liberal arts education and more akin to an an undergraduate technical training school for those who want to or could see themselves going to graduate school. Of those who don't go on to graduate school and/or stay in academics, however, there are also many reedies who simply use the strong work ethic they've acquired at reed to succeed in other job sectors."
"48","The school is really small, around 1300 and the campus is very small as well. There's a definite Reed bubble that's hard to escape. It takes a real effort to spend time off campus, especially when you have a lot of work. Moreover, the students are socially awkward, which makes the Reed bubble something a lot of students (unsuccessfully) try to escape. There's a big stress culture at Reed, which many students dislike. During exams we have a stim table where you can basically get pills, caffeinated beverages, and food for free. While there is a lot of work, people like to be really dramatic about it. Despite its liberal leanings, there's a lot of sexism and racism at Reed. The student body isn't particularly active on these issues. One unusual thing about Reed is Renn Fayre, which is a weekend long celebration for graduating seniors. It's a giant, school-sponsored party with bug-eating contests, a thesis parade, a drug pinata, and lube wrestling. It's supposed to be a way to let off steam for graduating seniors and for those about to take their final exams."
